{
  "$schema": "../../schema/authored-lesson.schema.json",
  "format": "authored-lesson",
  "schemaVersion": "1.0.0",
  "id": "lesson.html.forms.groups.v1",
  "courseId": "html",
  "courseVersion": "0.1.0",
  "moduleId": "html.forms",
  "skillId": "html.forms.groups",
  "title": "Groups, choices and autocomplete",
  "publication": {
    "stage": "draft",
    "author": {
      "id": "codex-assisted-draft",
      "displayName": "Codex-assisted web tranche",
      "kind": "ai-assisted"
    },
    "authoredAt": "2026-07-12T09:00:00.000Z",
    "aiAssisted": true,
    "reviewer": null,
    "changeSummary": "Technology-specific HTML: Semantic and Accessible Web Documents draft for Groups, choices and autocomplete; independent standards, browser, pedagogy, and accessibility review required. Beginner-quality contract 1.0.0 applied deterministically from existing source-linked draft facts; publication stage and reviewer state are unchanged."
  },
  "sources": [
    {
      "sourceRef": "whatwg-html",
      "locator": "HTML Living Standard; living standard accessed 2026-07; provisions applicable to Groups, choices and autocomplete",
      "claim": "fieldset and legend name a related group of controls, especially radio choices sharing one question."
    },
    {
      "sourceRef": "wcag22",
      "locator": "Web Content Accessibility Guidelines 2.2; W3C Recommendation 2023; provisions applicable to Groups, choices and autocomplete",
      "claim": "fieldset and legend name a related group of controls, especially radio choices sharing one question."
    }
  ],
  "canonicalExplanation": {
    "summary": "When several controls answer **one question** — radio buttons, related checkboxes, the parts of an address — wrap them in `<fieldset>` with a `<legend>` that asks the question. Each option still needs its own label. Radios share one `name` so only one can be chosen. The `autocomplete` attribute (`name`, `email`, `postal-code`…) tells browsers what each field is for, so they can fill it in correctly.",
    "sections": [
      {
        "heading": "Start here",
        "body": "A checkout asks for delivery: three radio buttons labelled \"Standard\", \"Express\", \"Pickup\". A screen-reader user tabs to one and hears \"Express, radio button, 2 of 3\" — Express what? Delivery? Payment? A delivery-method fieldset uses legend Delivery method and labels each radio option. In this lesson you'll group related choices and configure input purpose without relying on placeholder labels.\n\n```predict\n{\"question\": \"Three radios share `name=\\\"delivery\\\"`. How many can be selected at once?\", \"options\": [\"All three\", \"One\"], \"answer\": 1, \"why\": \"Radios with the same name form one group: selecting one deselects the others, and only that value is submitted.\"}\n```"
      },
      {
        "heading": "Before you begin",
        "body": "You should know **Paragraph and inline meaning**, **Relative and absolute URLs**, and **Labels and input controls** — every option needs its own label."
      },
      {
        "heading": "The model: fieldset asks, legend names, labels answer",
        "body": "```html\n<fieldset>\n  <legend>Delivery method</legend>\n  <label><input type=\"radio\" name=\"delivery\" value=\"standard\" checked> Standard (3–5 days)</label>\n  <label><input type=\"radio\" name=\"delivery\" value=\"express\"> Express (next day)</label>\n  <label><input type=\"radio\" name=\"delivery\" value=\"pickup\"> Pickup from store</label>\n</fieldset>\n\n<fieldset>\n  <legend>Shipping address</legend>\n  <label for=\"street\">Street</label>\n  <input id=\"street\" name=\"street\" autocomplete=\"street-address\">\n  <label for=\"pin\">PIN code</label>\n  <input id=\"pin\" name=\"pin\" autocomplete=\"postal-code\" inputmode=\"numeric\">\n</fieldset>\n```\n\n| Piece | Job |\n|---|---|\n| `fieldset`. | groups controls that answer one question. |\n| `legend`. | the question, announced with each option. |\n| shared radio `name`. | one choice per group. |\n| `autocomplete`. | tells the browser the field's purpose. |\n\n```reveal\n{\"prompt\": \"Does a single text field need a fieldset?\", \"answer\": \"No. A lone control just needs its label. Use fieldset when several controls share a question.\"}\n```"
      },
      {
        "heading": "Purpose, not placeholders",
        "body": "```predict\n{\"question\": \"What does `autocomplete=\\\"email\\\"` do?\", \"options\": [\"Validates the email format\", \"Tells browsers and password managers this field wants the user's email, so it can be filled correctly\"], \"answer\": 1, \"why\": \"autocomplete describes input purpose. It speeds up forms and helps people with memory or motor difficulties.\"}\n```"
      }
    ]
  },
  "scope": {
    "includes": [
      "Group related radios, checkboxes and multi-part fields with fieldset and legend.",
      "Set autocomplete tokens to declare each field's purpose."
    ],
    "excludes": [
      "Custom select widgets.",
      "Validation (next lesson)."
    ]
  },
  "outcomes": [
    "Group related choices and configure input purpose without relying on placeholder labels."
  ],
  "examples": [
    {
      "id": "html.forms.groups.example-a",
      "title": "Choosing a delivery method",
      "situation": "A delivery-method fieldset uses legend Delivery method and labels each radio option.",
      "walkthrough": [
        "**Fieldset with legend Delivery method:** names the question for the whole group.",
        "**Labels each radio option:** Standard, Express and Pickup each have their own label, and share `name=\"delivery\"`.",
        "**Result:** a screen reader will read \"Delivery method, Express (next day), radio button, 2 of 3\"."
      ],
      "result": "Every option is announced with its question, and only one delivery method can be chosen."
    },
    {
      "id": "html.forms.groups.example-b",
      "title": "The address form without purpose",
      "situation": "An address form has fields named f1–f5 with placeholders only; the browser autofills a phone number into the PIN code box.",
      "walkthrough": [
        "The browser couldn't tell what each field was for.",
        "Placeholders vanished while typing, and no labels named the fields.",
        "Fix: labels for each field, a fieldset with legend Shipping address, and autocomplete tokens like `postal-code`."
      ],
      "result": "Autofill puts the right values in the right boxes, and each field is clearly named."
    }
  ],
  "misconceptions": [
    {
      "id": "html.forms.groups.misconception",
      "mistakenBelief": "Radio buttons with the same name never need a group label.",
      "correction": "A shared name only makes the options mutually exclusive; it doesn't name the question. Without a fieldset and legend, users hear options like \"Express\" without knowing what they're choosing.",
      "diagnosticPrompt": "In \"Choosing a delivery method\", what does the legend add to each option's announcement?"
    }
  ],
  "analogy": {
    "optional": true,
    "example": "A fieldset is like a **question on a paper survey** with tick boxes under it: the question (legend) makes sense of the answers (labels). autocomplete is like writing \"for office use: postcode\" next to a box so the clerk knows what goes there.",
    "usefulFor": [
      "remembering legend = the question",
      "seeing autocomplete as declaring purpose"
    ],
    "limitations": [
      "Paper surveys can't enforce one choice; shared radio names do.",
      "Browsers can fill fields for you only if purpose is declared."
    ],
    "canonicalExplanationStandsAlone": true
  },
  "trace": {
    "artifact": [
      "<fieldset><legend>Delivery method</legend>",
      "<label><input type='radio' name='delivery' value='express'> Express</label>",
      "Tab to Express"
    ],
    "steps": [
      {
        "step": 1,
        "focus": "Group",
        "state": {
          "legend": "Delivery method"
        },
        "explanation": "A delivery-method fieldset uses legend Delivery method."
      },
      {
        "step": 2,
        "focus": "Options",
        "state": {
          "name": "delivery",
          "labels": "Standard, Express, Pickup"
        },
        "explanation": "It labels each radio option and shares one name."
      },
      {
        "step": 3,
        "focus": "Announce",
        "state": {
          "screen reader": "Delivery method, Express, radio button, 2 of 3"
        },
        "explanation": "Each option is read with its question."
      }
    ],
    "textAlternative": "A grouped radio question. Step 1, Group: legend is Delivery method. A delivery-method fieldset uses legend Delivery method. Step 2, Options: name is delivery; labels is Standard, Express, Pickup. It labels each radio option and shares one name. Step 3, Announce: screen reader is Delivery method, Express, radio button, 2 of 3. Each option is read with its question."
  },
  "practice": {
    "faded": {
      "prompt": "For \"Choosing a delivery method\", explain why the delivery-method fieldset uses legend Delivery method and how it labels each radio option.",
      "scaffold": [
        "fieldset.",
        "legend.",
        "labels."
      ],
      "expectedEvidence": [
        "Names the example \"Choosing a delivery method\": a delivery-method fieldset.",
        "It uses legend Delivery method to name the question.",
        "It labels each radio option: Standard, Express, Pickup.",
        "Only one can be chosen because they share a name."
      ]
    },
    "nearTransfer": {
      "prompt": "Mark up a \"Topics you're interested in\" question with three checkboxes (HTML, CSS, JavaScript).",
      "scaffold": [
        "Checkboxes can share a name or not.",
        "Needs a legend."
      ],
      "expectedEvidence": [
        "fieldset with legend 'Topics you're interested in'.",
        "Three labelled checkboxes."
      ]
    },
    "farTransfer": {